{
  "version": "1.6",
  "$schema": "https://raw.githubusercontent.com/openctemio/ctis/main/schemas/v1/report.json",
  "metadata": {
    "id": "import-test",
    "timestamp": "2026-10-05T12:00:00Z",
    "source_type": "manual"
  },
  "tool": {
    "name": "nuclei",
    "vendor": "ProjectDiscovery",
    "info_url": "https://github.com/projectdiscovery/nuclei",
    "capabilities": [
      "dast"
    ]
  },
  "assets": [
    {
      "id": "asset-1",
      "type": "domain",
      "value": "example.com",
      "name": "example.com"
    },
    {
      "id": "asset-2",
      "type": "domain",
      "value": "expired.example.com",
      "name": "expired.example.com"
    },
    {
      "id": "asset-3",
      "type": "ip_address",
      "value": "10.0.0.7",
      "name": "10.0.0.7"
    }
  ],
  "findings": [
    {
      "type": "vulnerability",
      "title": "Apache RCE",
      "description": "Remote code execution in Apache HTTP Server.",
      "message": "Apache RCE at https://example.com/cgi-bin/test",
      "severity": "critical",
      "confidence": 90,
      "rule_id": "cve-2023-1234",
      "asset_ref": "asset-1",
      "vulnerability": {
        "cve_id": "CVE-2023-1234",
        "cve_ids": [
          "CVE-2023-1234"
        ],
        "cwe_ids": [
          "CWE-78"
        ],
        "cwe_id": "CWE-78",
        "cvss_version": "3.1",
        "cvss_score": 9.8,
        "cvss_vector": "CVSS:3.1/AV:N/AC:L/PR:N/UI:N/S:U/C:H/I:H/A:H",
        "ids": [
          {
            "type": "cve",
            "id": "CVE-2023-1234"
          }
        ]
      },
      "remediation": {
        "recommendation": "Upgrade Apache to version 2.4.58 or later."
      },
      "references": [
        "https://nvd.nist.gov/vuln/detail/CVE-2023-1234",
        "https://httpd.apache.org/security/",
        "https://github.com/projectdiscovery/nuclei-templates/blob/main/cves/2023/CVE-2023-1234.yaml"
      ],
      "tags": [
        "cve",
        "apache",
        "rce",
        "nuclei",
        "http"
      ],
      "fingerprint": "ead2725aa7347fea093b8b952f114242a64cf55aeb95ded7f1555dd5ec897886",
      "native": {
        "scheme": "other",
        "vuln_id": "cve-2023-1234",
        "severity": "critical",
        "raw_ref": "line 1"
      },
      "scores": [
        {
          "system": "cvss",
          "version": "3.1",
          "vector": "CVSS:3.1/AV:N/AC:L/PR:N/UI:N/S:U/C:H/I:H/A:H",
          "value": 9.8,
          "source": "nuclei-templates"
        }
      ],
      "source_extra": {
        "matcher_name": "body",
        "target": "https://example.com"
      },
      "web": {
        "url": "https://example.com/cgi-bin/test"
      },
      "evidence_items": [
        {
          "kind": "curl",
          "version": 1,
          "text": "curl -X GET https://example.com/cgi-bin/test"
        }
      ]
    },
    {
      "type": "vulnerability",
      "title": "Apache HTTP Server Detection",
      "description": "Apache HTTP Server was detected.",
      "message": "Apache HTTP Server Detection at https://example.com/",
      "severity": "info",
      "confidence": 90,
      "rule_id": "tech-detect",
      "asset_ref": "asset-1",
      "tags": [
        "tech",
        "apache",
        "nuclei",
        "http"
      ],
      "fingerprint": "da0374e50c79cf07707f83ad0084ee3340fb24f033ab2f1f3ba91d5904549f32",
      "native": {
        "scheme": "other",
        "vuln_id": "tech-detect",
        "severity": "info",
        "raw_ref": "line 2"
      },
      "source_extra": {
        "target": "https://example.com"
      },
      "web": {
        "url": "https://example.com/"
      }
    },
    {
      "type": "vulnerability",
      "title": "Expired SSL Certificate",
      "description": "The SSL certificate has expired.",
      "message": "Expired SSL Certificate at https://expired.example.com:443",
      "severity": "high",
      "confidence": 90,
      "rule_id": "ssl-expired",
      "asset_ref": "asset-2",
      "references": [
        "https://ssl-config.mozilla.org/"
      ],
      "tags": [
        "ssl",
        "tls",
        "expired",
        "nuclei"
      ],
      "fingerprint": "3219f7ffe6d9eef3175c2f4df98170ea3e8a0ab724ef8f3defe083215522d7b4",
      "native": {
        "scheme": "other",
        "vuln_id": "ssl-expired",
        "severity": "high",
        "raw_ref": "line 3"
      },
      "source_extra": {
        "target": "https://expired.example.com"
      },
      "web": {
        "url": "https://expired.example.com/"
      }
    },
    {
      "type": "vulnerability",
      "title": "Grafana Login Panel",
      "message": "Grafana Login Panel at http://10.0.0.7:3000/login",
      "severity": "info",
      "confidence": 90,
      "rule_id": "exposed-panel-grafana",
      "asset_ref": "asset-3",
      "tags": [
        "panel",
        "grafana",
        "nuclei",
        "http"
      ],
      "fingerprint": "c9853fec4857cd75b9ade6680fd55f926ced93a9a40500cdc5795e3ab3b5815e",
      "native": {
        "scheme": "other",
        "vuln_id": "exposed-panel-grafana",
        "severity": "info",
        "raw_ref": "line 4"
      },
      "source_extra": {
        "target": "10.0.0.7:3000"
      },
      "web": {
        "url": "http://10.0.0.7:3000/login"
      }
    }
  ]
}
