{
  "version": "1.3",
  "metadata": {"timestamp": "2026-10-02T09:30:00Z", "source_type": "scanner", "coverage_type": "full"},
  "tool": {"name": "gitleaks", "version": "8.21.0", "capabilities": ["secret"]},
  "assets": [{"id": "repo", "type": "repository", "value": "github.com/example/shop"}],
  "findings": [
    {
      "id": "f-1",
      "type": "secret",
      "title": "AWS access key ID committed to the repository",
      "severity": "critical",
      "rule_id": "aws-access-token",
      "asset_ref": "repo",
      "fingerprint": "a3f1c2e4b5d6a7f8091a2b3c4d5e6f708192a3b4c5d6e7f8091a2b3c4d5e6f70",
      "location": {"path": "deploy/env.sh", "start_line": 3, "commit_sha": "1a2b3c4d5e6f7a8b9c0d1e2f3a4b5c6d7e8f9a0b"},
      "secret": {
        "secret_type": "aws_key",
        "service": "aws",
        "masked_value": "AKIA************MPLE",
        "length": 20,
        "entropy": 3.68,
        "valid": true,
        "verified_at": "2026-10-02T09:29:10Z",
        "revoked": false,
        "in_history_only": true,
        "commit_count": 2,
        "age_in_days": 412
      }
    }
  ]
}
