{
  "version": "1.6",
  "$schema": "https://raw.githubusercontent.com/openctemio/ctis/main/schemas/v1/report.json",
  "metadata": {
    "id": "import-test",
    "timestamp": "2026-10-05T12:00:00Z",
    "source_type": "manual",
    "scope": {
      "name": "github.com/example/shop"
    }
  },
  "tool": {
    "name": "betterleaks",
    "vendor": "Betterleaks",
    "info_url": "https://github.com/betterleaks/betterleaks",
    "capabilities": [
      "secret"
    ]
  },
  "assets": [
    {
      "id": "asset-1",
      "type": "repository",
      "value": "github.com/example/shop",
      "name": "github.com/example/shop",
      "properties": {
        "branch": "main",
        "commit_sha": "3f1c2a9e",
        "source": "import_options"
      }
    }
  ],
  "findings": [
    {
      "type": "secret",
      "title": "AWS Access Key",
      "message": "Secret detected: AWS Access Key in config.yml",
      "severity": "critical",
      "confidence": 85,
      "rule_id": "aws-access-key-id",
      "asset_ref": "asset-1",
      "location": {
        "path": "config.yml",
        "start_line": 10,
        "end_line": 10,
        "start_column": 1,
        "end_column": 20,
        "snippet": "AKIA********",
        "commit_sha": "abc123def456"
      },
      "secret": {
        "secret_type": "aws_key",
        "service": "aws",
        "masked_value": "AKIA********",
        "length": 20,
        "entropy": 3.6
      },
      "tags": [
        "betterleaks",
        "secret"
      ],
      "fingerprint": "config.yml:aws-access-key-id:10",
      "author": "dev@example.com",
      "author_email": "dev@example.com",
      "commit_date": "2023-01-15T10:30:00Z",
      "native": {
        "scheme": "other",
        "vuln_id": "aws-access-key-id",
        "raw_ref": "/0"
      },
      "source_extra": {
        "commit_message": "add config"
      }
    },
    {
      "type": "secret",
      "title": "Generic API Key",
      "message": "Secret detected: Generic API Key in src/config.py",
      "severity": "high",
      "confidence": 85,
      "rule_id": "generic-api-key",
      "asset_ref": "asset-1",
      "location": {
        "path": "src/config.py",
        "start_line": 25,
        "end_line": 25,
        "start_column": 10,
        "end_column": 50,
        "snippet": "api_key = \"sk_l********\"",
        "commit_sha": "def789abc012"
      },
      "secret": {
        "secret_type": "api_key",
        "masked_value": "sk_l********",
        "length": 27,
        "entropy": 4.2
      },
      "tags": [
        "betterleaks",
        "secret"
      ],
      "fingerprint": "src/config.py:generic-api-key:25",
      "author": "admin@example.com",
      "author_email": "admin@example.com",
      "native": {
        "scheme": "other",
        "vuln_id": "generic-api-key",
        "raw_ref": "/1"
      }
    },
    {
      "type": "secret",
      "title": "GitHub Personal Access Token",
      "message": "Secret detected: GitHub Personal Access Token in .env",
      "severity": "critical",
      "confidence": 85,
      "rule_id": "github-pat",
      "asset_ref": "asset-1",
      "location": {
        "path": ".env",
        "start_line": 5,
        "end_line": 5,
        "start_column": 1,
        "end_column": 40,
        "snippet": "ghp_********",
        "commit_sha": "111222333444"
      },
      "secret": {
        "secret_type": "generic_secret",
        "service": "github",
        "masked_value": "ghp_********",
        "length": 40
      },
      "tags": [
        "betterleaks",
        "secret",
        "github",
        "pat"
      ],
      "fingerprint": ".env:github-pat:5",
      "author": "dev2@example.com",
      "author_email": "dev2@example.com",
      "native": {
        "scheme": "other",
        "vuln_id": "github-pat",
        "raw_ref": "/2"
      }
    },
    {
      "type": "secret",
      "title": "Stripe Secret Key",
      "message": "Secret detected: Stripe Secret Key in payment.js",
      "severity": "high",
      "confidence": 85,
      "rule_id": "stripe-api-key",
      "asset_ref": "asset-1",
      "location": {
        "path": "payment.js",
        "start_line": 3,
        "end_line": 3,
        "start_column": 1,
        "end_column": 30,
        "commit_sha": "aaa111bbb222"
      },
      "secret": {
        "secret_type": "api_key",
        "service": "stripe",
        "masked_value": "sk_t********",
        "length": 20
      },
      "tags": [
        "betterleaks",
        "secret"
      ],
      "fingerprint": "payment.js:stripe-api-key:3",
      "native": {
        "scheme": "other",
        "vuln_id": "stripe-api-key",
        "raw_ref": "/3"
      }
    }
  ]
}
