{
  "version": "1.5",
  "$schema": "https://raw.githubusercontent.com/openctemio/ctis/main/schemas/v1/report.json",
  "metadata": {
    "id": "import-test",
    "timestamp": "2026-10-05T12:00:00Z",
    "source_type": "manual"
  },
  "tool": {
    "name": "CodeQL",
    "version": "2.15.0",
    "capabilities": [
      "sast"
    ]
  },
  "assets": [
    {
      "id": "asset-1",
      "type": "repository",
      "value": "https://github.com/example/shop",
      "name": "https://github.com/example/shop",
      "properties": {
        "branch": "refs/heads/main",
        "commit_sha": "3f1c2a9e0b7d4c5a8e6f1d2b3c4a5e6f7a8b9c0d",
        "source": "sarif_version_control_provenance"
      }
    }
  ],
  "findings": [
    {
      "id": "finding-1",
      "type": "vulnerability",
      "title": "This query depends on a user-provided value.",
      "description": "Database query built from user-controlled sources",
      "severity": "high",
      "confidence": 85,
      "rule_id": "go/sql-injection",
      "rule_name": "go/sql-injection",
      "asset_ref": "asset-1",
      "location": {
        "path": "internal/store/orders.go",
        "start_line": 42,
        "start_column": 9,
        "end_column": 61
      },
      "vulnerability": {
        "cwe_ids": [
          "CWE-89"
        ],
        "cwe_id": "CWE-89"
      },
      "tags": [
        "security",
        "external/cwe/cwe-089"
      ],
      "partial_fingerprints": {
        "primaryLocationLineHash": "8e1f0c2d3a4b5c6d:1"
      }
    }
  ]
}
