{
  "version": "1.6",
  "$schema": "https://raw.githubusercontent.com/openctemio/ctis/main/schemas/v1/report.json",
  "metadata": {
    "id": "import-test",
    "timestamp": "2026-10-05T12:00:00Z",
    "source_type": "manual",
    "branch": {
      "name": "main",
      "is_default_branch": false,
      "commit_sha": "3f1c2a9e"
    },
    "scope": {
      "name": "github.com/example/shop"
    }
  },
  "tool": {
    "name": "TestScanner",
    "version": "1.0.0",
    "capabilities": [
      "vulnerability"
    ]
  },
  "assets": [
    {
      "id": "asset-1",
      "type": "repository",
      "value": "github.com/example/shop",
      "name": "github.com/example/shop",
      "properties": {
        "branch": "main",
        "commit_sha": "3f1c2a9e",
        "source": "import_options"
      }
    }
  ],
  "findings": [
    {
      "id": "finding-1",
      "type": "vulnerability",
      "title": "SQL injection in login handler",
      "description": "SQL Injection vulnerability detected",
      "severity": "high",
      "confidence": 85,
      "rule_id": "rule-001",
      "rule_name": "SQL Injection",
      "asset_ref": "asset-1",
      "location": {
        "path": "src/auth/login.go",
        "start_line": 42,
        "end_line": 42,
        "start_column": 10,
        "end_column": 55,
        "snippet": "db.Query(\"SELECT * FROM users WHERE id=\" + userInput)",
        "branch": "main",
        "commit_sha": "3f1c2a9e"
      },
      "vulnerability": {
        "cwe_ids": [
          "CWE-89"
        ],
        "cwe_id": "CWE-89",
        "owasp_ids": [
          "A03:2021"
        ]
      },
      "references": [
        "https://owasp.org/Top10/A03_2021-Injection/"
      ],
      "tags": [
        "CWE-89: SQL Injection",
        "OWASP-A03:2021 - Injection",
        "security",
        "high"
      ],
      "fingerprint": "abc123def456",
      "data_flow": {
        "sources": [
          {
            "path": "src/auth/login.go",
            "line": 38,
            "type": "source"
          }
        ],
        "intermediates": [
          {
            "path": "src/auth/login.go",
            "line": 40,
            "index": 1,
            "type": "propagator"
          }
        ],
        "sinks": [
          {
            "path": "src/auth/login.go",
            "line": 42,
            "index": 2,
            "type": "sink"
          }
        ],
        "tainted": true
      }
    },
    {
      "id": "finding-2",
      "type": "vulnerability",
      "title": "Hardcoded API key found",
      "description": "Hardcoded credential detected",
      "severity": "medium",
      "confidence": 90,
      "rule_id": "rule-002",
      "rule_name": "Hardcoded Secret",
      "asset_ref": "asset-1",
      "location": {
        "path": "src/config/keys.go",
        "start_line": 15,
        "start_column": 1,
        "branch": "main",
        "commit_sha": "3f1c2a9e"
      },
      "vulnerability": {
        "cwe_ids": [
          "CWE-798"
        ],
        "cwe_id": "CWE-798"
      },
      "tags": [
        "CWE-798: Use of Hard-coded Credentials",
        "security"
      ]
    },
    {
      "id": "finding-3",
      "type": "vulnerability",
      "title": "Debug endpoint exposed",
      "description": "Information disclosure",
      "severity": "low",
      "confidence": 90,
      "rule_id": "rule-003",
      "rule_name": "Info Disclosure",
      "asset_ref": "asset-1",
      "location": {
        "path": "src/debug/handler.go",
        "start_line": 8,
        "branch": "main",
        "commit_sha": "3f1c2a9e"
      }
    }
  ]
}
