{
  "version": "1.3",
  "metadata": {"timestamp": "2026-10-02T14:00:00Z", "source_type": "scanner", "scope": {"name": "example.com", "type": "domain"}},
  "tool": {"name": "recon-pipeline", "capabilities": ["subdomain", "dns", "portscan", "http_probe"]},
  "assets": [
    {
      "id": "d-example",
      "type": "domain",
      "value": "example.com",
      "technical": {"domain": {"registrar": "Example Registrar, Inc.", "expires_at": "2027-08-13T04:00:00Z", "nameservers": ["a.iana-servers.net"], "dns_records": [{"type": "A", "name": "example.com", "value": "93.184.216.34", "ttl": 300}]}}
    },
    {"id": "d-api", "type": "subdomain", "value": "api.example.com", "related_assets": ["d-example", "ip-1"]},
    {
      "id": "ip-1",
      "type": "ip_address",
      "value": "93.184.216.34",
      "technical": {"ip_address": {"version": 4, "asn": 15133, "asn_org": "Edgecast", "country": "US", "geolocation": {"latitude": 42.15, "longitude": -70.82}}}
    },
    {
      "id": "cert-1",
      "type": "certificate",
      "value": "8f43288ad272f3103b6fb1428485ea3014c0bcfe",
      "technical": {"certificate": {"subject_cn": "*.example.com", "sans": ["*.example.com", "example.com"], "issuer_cn": "DigiCert Global G2 TLS RSA SHA256 2020 CA1", "not_before": "2026-01-15T00:00:00Z", "not_after": "2027-02-15T23:59:59Z", "key_algorithm": "RSA", "key_size": 2048, "wildcard": true}}
    },
    {
      "id": "http-1",
      "type": "http_service",
      "value": "https://api.example.com",
      "is_internet_accessible": true,
      "technical": {"service": {"name": "nginx", "port": 443, "protocol": "https", "transport": "tcp", "tls": true, "tls_version": "tls1.3", "state": "open"}},
      "properties": {"status_code": 200, "title": "API"}
    },
    {
      "id": "svc-ssh",
      "type": "service",
      "value": "93.184.216.34:22",
      "technical": {"service": {"name": "ssh", "port": 22, "protocol": "ssh", "transport": "tcp", "product": "OpenSSH", "version": "9.6p1", "auth_methods": ["publickey"], "state": "open"}}
    }
  ]
}
