{
  "version": "1.4",
  "$schema": "https://raw.githubusercontent.com/openctemio/ctis/main/schemas/v1/report.json",
  "metadata": {
    "id": "import-test",
    "timestamp": "2026-10-05T12:00:00Z",
    "source_type": "manual"
  },
  "tool": {
    "name": "trivy",
    "vendor": "Aqua Security",
    "capabilities": [
      "sca",
      "misconfiguration",
      "secret"
    ]
  },
  "assets": [
    {
      "id": "asset-1",
      "type": "container",
      "value": "registry.example.com/shop/api:1.4.2",
      "name": "registry.example.com/shop/api:1.4.2",
      "properties": {
        "image_id": "sha256:0000000000000000000000000000000000000000000000000000000000000001",
        "os": "debian 12.7",
        "repo_digest": "registry.example.com/shop/api@sha256:0000000000000000000000000000000000000000000000000000000000000003",
        "source": "trivy_artifact"
      }
    }
  ],
  "findings": [
    {
      "type": "vulnerability",
      "title": "openssl: SSL_select_next_proto buffer overread",
      "description": "Calling SSL_select_next_proto with an empty supported client protocols buffer may cause a crash.",
      "severity": "low",
      "rule_id": "CVE-2024-5535",
      "asset_ref": "asset-1",
      "vulnerability": {
        "cve_id": "CVE-2024-5535",
        "cve_ids": [
          "CVE-2024-5535"
        ],
        "cwe_ids": [
          "CWE-200"
        ],
        "cwe_id": "CWE-200",
        "cvss_version": "3.1",
        "cvss_score": 9.1,
        "cvss_vector": "CVSS:3.1/AV:N/AC:L/PR:N/UI:N/S:U/C:H/I:N/A:H",
        "cvss_source": "nvd",
        "package": "libssl3",
        "purl": "pkg:deb/debian/libssl3@3.0.14-1~deb12u1?arch=amd64&distro=debian-12.7",
        "affected_version": "3.0.14-1~deb12u1",
        "fixed_version": "3.0.15-1~deb12u1",
        "published_at": "2024-06-27T11:15:24.447Z",
        "modified_at": "2024-09-04T21:15:05.193Z",
        "data_source": {
          "id": "debian",
          "name": "Debian Security Tracker",
          "url": "https://salsa.debian.org/security-tracker-team/security-tracker"
        },
        "severity_source": "debian",
        "vendor_severity": {
          "debian": 1,
          "nvd": 4,
          "redhat": 2
        },
        "layer": {
          "digest": "sha256:0000000000000000000000000000000000000000000000000000000000000004",
          "diff_id": "sha256:0000000000000000000000000000000000000000000000000000000000000002"
        },
        "vuln_status": "fixed",
        "ids": [
          {
            "type": "cve",
            "id": "CVE-2024-5535"
          },
          {
            "type": "vendor",
            "id": "DSA-5764-1"
          }
        ]
      },
      "remediation": {
        "recommendation": "Upgrade libssl3 to 3.0.15-1~deb12u1",
        "fix_available": true,
        "solution_type": "upgrade"
      },
      "references": [
        "https://avd.aquasec.com/nvd/cve-2024-5535",
        "https://www.openssl.org/news/secadv/20240627.txt"
      ],
      "tags": [
        "trivy",
        "registry.example.com/shop/api:1.4.2 (debian 12.7)"
      ],
      "fingerprint": "4bc4940ed45f7476f66bebdb95644e0e262a5871deb51586169098bd53797a70",
      "native": {
        "scheme": "other",
        "vuln_id": "CVE-2024-5535",
        "severity": "LOW"
      },
      "scores": [
        {
          "system": "cvss",
          "version": "4.0",
          "vector": "CVSS:4.0/AV:N/AC:L/AT:N/PR:N/UI:N/VC:H/VI:N/VA:H/SC:N/SI:N/SA:N",
          "value": 8.8,
          "source": "ghsa"
        },
        {
          "system": "cvss",
          "version": "3.1",
          "vector": "CVSS:3.1/AV:N/AC:L/PR:N/UI:N/S:U/C:H/I:N/A:H",
          "value": 9.1,
          "source": "nvd"
        },
        {
          "system": "cvss",
          "version": "2.0",
          "vector": "AV:N/AC:L/Au:N/C:P/I:N/A:N",
          "value": 5,
          "source": "nvd"
        },
        {
          "system": "cvss",
          "version": "3.1",
          "vector": "CVSS:3.1/AV:N/AC:H/PR:N/UI:N/S:U/C:L/I:N/A:L",
          "value": 4.8,
          "source": "redhat"
        }
      ],
      "source_extra": {
        "pkg_id": "libssl3@3.0.14-1~deb12u1",
        "target": "registry.example.com/shop/api:1.4.2 (debian 12.7)"
      }
    },
    {
      "type": "misconfiguration",
      "title": "Process can elevate its own privileges",
      "description": "A program inside the container can elevate its own privileges.",
      "message": "Container 'api' should set 'securityContext.allowPrivilegeEscalation' to false",
      "severity": "medium",
      "rule_id": "KSV001",
      "asset_ref": "asset-1",
      "location": {
        "path": "deploy/k8s.yaml",
        "start_line": 20,
        "end_line": 34
      },
      "misconfiguration": {
        "policy_id": "KSV001",
        "policy_name": "Process can elevate its own privileges",
        "avd_id": "AVD-KSV-0001",
        "resource_name": "Deployment/api",
        "provider": "Kubernetes",
        "service": "general",
        "namespace": "builtin.kubernetes.KSV001",
        "query": "data.builtin.kubernetes.KSV001.deny"
      },
      "remediation": {
        "recommendation": "Set 'set containers[].securityContext.allowPrivilegeEscalation' to 'false'.",
        "solution_type": "config"
      },
      "references": [
        "https://avd.aquasec.com/misconfig/ksv001",
        "https://kubernetes.io/docs/concepts/security/pod-security-standards/#restricted"
      ],
      "tags": [
        "trivy",
        "misconfiguration",
        "deploy/k8s.yaml"
      ],
      "fingerprint": "8049dd5d07a0188f7ecdf51b4ece4294f1bab970b8e488b3a72363f86f9bc4af",
      "native": {
        "scheme": "other",
        "vuln_id": "KSV001",
        "severity": "MEDIUM",
        "status": "FAIL"
      },
      "source_extra": {
        "misconfig_type": "Kubernetes Security Check",
        "target": "deploy/k8s.yaml"
      }
    },
    {
      "type": "secret",
      "title": "GitHub Personal Access Token",
      "severity": "critical",
      "rule_id": "github-pat",
      "asset_ref": "asset-1",
      "location": {
        "path": "app/settings.py",
        "start_line": 12,
        "end_line": 12,
        "snippet": "TOKE********"
      },
      "secret": {
        "secret_type": "token"
      },
      "tags": [
        "trivy",
        "secret",
        "app/settings.py"
      ],
      "fingerprint": "43f8b4506278054616914755f75393ac3a1889eef2534bbe576ae516cad0b0f9",
      "native": {
        "scheme": "other",
        "vuln_id": "github-pat",
        "severity": "CRITICAL"
      },
      "source_extra": {
        "category": "GitHub"
      }
    }
  ],
  "dependencies": [
    {
      "id": "libssl3@3.0.14-1~deb12u1",
      "name": "libssl3",
      "version": "3.0.14-1~deb12u1",
      "purl": "pkg:deb/debian/libssl3@3.0.14-1~deb12u1?arch=amd64&distro=debian-12.7",
      "uid": "a1b2c3d4",
      "licenses": [
        "Apache-2.0"
      ],
      "relationship": "direct",
      "depends_on": [
        "libc6@2.36-9+deb12u8"
      ]
    }
  ]
}
