{
  "version": "1.6",
  "$schema": "https://raw.githubusercontent.com/openctemio/ctis/main/schemas/v1/report.json",
  "metadata": {
    "id": "import-test",
    "timestamp": "2026-10-05T12:00:00Z",
    "source_type": "manual",
    "scope": {
      "name": "github.com/example/shop"
    }
  },
  "tool": {
    "name": "semgrep",
    "version": "1.149.0",
    "vendor": "Semgrep, Inc.",
    "capabilities": [
      "sast"
    ]
  },
  "assets": [
    {
      "id": "asset-1",
      "type": "repository",
      "value": "github.com/example/shop",
      "name": "github.com/example/shop",
      "properties": {
        "branch": "main",
        "commit_sha": "3f1c2a9e",
        "source": "import_options"
      }
    }
  ],
  "findings": [
    {
      "type": "vulnerability",
      "title": "exec",
      "message": "exec",
      "severity": "medium",
      "confidence": 70,
      "rule_id": "go-exec",
      "rule_name": "Go Exec",
      "asset_ref": "asset-1",
      "location": {
        "path": "src2/b.go",
        "start_line": 3,
        "end_line": 3,
        "start_column": 20,
        "end_column": 35
      },
      "tags": [
        "semgrep"
      ],
      "fingerprint": "eb7de1a66105556096b546e6d80ae6af5a6d6cd431610e9a0d0b08ccccb6b337",
      "native": {
        "scheme": "other",
        "vuln_id": "go-exec",
        "severity": "WARNING",
        "raw_ref": "/results/0"
      },
      "source_extra": {
        "engine_kind": "OSS",
        "validation_state": "NO_VALIDATOR"
      }
    },
    {
      "type": "vulnerability",
      "title": "exec",
      "message": "exec",
      "severity": "high",
      "confidence": 70,
      "rule_id": "js-exec",
      "rule_name": "Js Exec",
      "asset_ref": "asset-1",
      "location": {
        "path": "src2/broken.js",
        "start_line": 2,
        "end_line": 2,
        "start_column": 18,
        "end_column": 28
      },
      "tags": [
        "semgrep"
      ],
      "fingerprint": "54c987d0319ef6332d420ce075cfe6f54ab96a52ddd47444d58cf4e0035ed304",
      "native": {
        "scheme": "other",
        "vuln_id": "js-exec",
        "severity": "ERROR",
        "raw_ref": "/results/1"
      },
      "source_extra": {
        "engine_kind": "OSS",
        "validation_state": "NO_VALIDATOR"
      }
    }
  ]
}
